{"compatibility":{"consumerContract":{"maxVersion":"1.0.0","minVersion":"1.0.0"}},"contents":{"presets":{"bytes":1331288,"count":4631,"path":"revisions/00000004/presets.json","sha256":"f5c30434650cc69546717a2446091973d124a0084eef7d9b491fee8e4e3ef76f"},"profiles":{"bytes":21467,"count":63,"path":"revisions/00000004/profiles.json","sha256":"0e4d21893684c695515abb4c6d29c60b8a56376f1e0a32461abe504a02aa5549"}},"provenance":{"generatedAt":"2026-09-26T12:26:53.000Z","generatedBy":"gajae-code-presets/scripts/import-upstream.mjs@1","sourcePaths":["packages/ai/src/models.json","packages/coding-agent/src/config/model-profiles.ts"],"sourceRepository":"https://github.com/Yeachan-Heo/gajae-code","sourceRevision":"69e39df425b182694000bfcc81162c2bffb071c6"},"registryRevision":4,"revision":"00000004","schemaVersion":"1.0.0"}