{"compatibility":{"consumerContract":{"maxVersion":"1.0.0","minVersion":"1.0.0"}},"contents":{"presets":{"bytes":1334291,"count":4639,"path":"revisions/00000005/presets.json","sha256":"369a5bd42a725ebd665e6fe92ee194cdd5554c7d11ddf8336ec954ddb3796eac"},"profiles":{"bytes":21505,"count":63,"path":"revisions/00000005/profiles.json","sha256":"476981dbc646220e62e6799e2f8968ed2d39b049ea0dda93a159fd10cf05d270"}},"provenance":{"generatedAt":"2026-09-30T12:24:15.000Z","generatedBy":"gajae-code-presets/scripts/import-upstream.mjs@1","sourcePaths":["packages/ai/src/models.json","packages/coding-agent/src/config/model-profiles.ts"],"sourceRepository":"https://github.com/Yeachan-Heo/gajae-code","sourceRevision":"1e5acb361438ff760333beff363d41f18bfbadfa"},"registryRevision":5,"revision":"00000005","schemaVersion":"1.0.0"}