{"compatibility":{"consumerContract":{"maxVersion":"1.0.0","minVersion":"1.0.0"}},"contents":{"presets":{"bytes":1230434,"count":4271,"path":"revisions/00000001/presets.json","sha256":"a73a9d0876198475902e7b87ac59dce37746025b35711767bd7ba6afe4104d96"},"profiles":{"bytes":19679,"count":58,"path":"revisions/00000001/profiles.json","sha256":"8befc86c52621d18f71ad141cd194329e8299bcfd50772faaf68b7f9c5b379cd"}},"provenance":{"generatedAt":"2026-08-24T09:41:42.000Z","generatedBy":"gajae-code-presets/scripts/import-upstream.mjs@1","sourcePaths":["packages/ai/src/models.json","packages/coding-agent/src/config/model-profiles.ts"],"sourceRepository":"https://github.com/Yeachan-Heo/gajae-code","sourceRevision":"65d0d2fdae36a4512959a6a8c143339b8ec98c58"},"registryRevision":1,"revision":"00000001","schemaVersion":"1.0.0"}