{"compatibility":{"consumerContract":{"maxVersion":"1.0.0","minVersion":"1.0.0"}},"contents":{"presets":{"bytes":1233171,"count":4279,"path":"revisions/00000003/presets.json","sha256":"b01774b4593233de67bcbc9a643ea6c6eca34f6a1846ccbae32f7a538272ced6"},"profiles":{"bytes":21501,"count":63,"path":"revisions/00000003/profiles.json","sha256":"4910423cfc37e9381c78954449d1446da093a162c15fc9344b4752bd34d1cb0e"}},"provenance":{"generatedAt":"2026-09-05T06:27:11.000Z","generatedBy":"gajae-code-presets/scripts/import-upstream.mjs@1","sourcePaths":["packages/ai/src/models.json","packages/coding-agent/src/config/model-profiles.ts"],"sourceRepository":"https://github.com/Yeachan-Heo/gajae-code","sourceRevision":"bf6a86b3107a2a2a21dfed38edb617bedd280c27"},"registryRevision":3,"revision":"00000003","schemaVersion":"1.0.0"}