{"compatibility":{"consumerContract":{"maxVersion":"1.0.0","minVersion":"1.0.0"}},"contents":{"presets":{"bytes":1244558,"count":4310,"path":"revisions/00000002/presets.json","sha256":"3c8b803b22950a3c4a9102b7d64346fc8d5d085d73f1cb453f609725cfd2de6a"},"profiles":{"bytes":19719,"count":58,"path":"revisions/00000002/profiles.json","sha256":"4edb58e8b6dc866c3c52871039c3027c94bb0029e2e91196147e9bbb0043cb62"}},"provenance":{"generatedAt":"2026-09-02T00:38:18.000Z","generatedBy":"gajae-code-presets/scripts/import-upstream.mjs@1","sourcePaths":["packages/ai/src/models.json","packages/coding-agent/src/config/model-profiles.ts"],"sourceRepository":"https://github.com/Yeachan-Heo/gajae-code","sourceRevision":"67fb0355a6c7d124a2dbbfd701228069b991858b"},"registryRevision":2,"revision":"00000002","schemaVersion":"1.0.0"}